{
  "version": "0.1",
  "epoch": "e1",
  "snapshot_id": "s1",
  "through": 10,
  "resources": [
    {
      "version": "0.1",
      "ref": {
        "publisher": "https://shop.example",
        "namespace": "addp",
        "id": "https://shop.example/addp/resources/o17"
      },
      "type": "https://schema.org/Offer",
      "profile": "offer-search/0.1",
      "revision": "r8",
      "facts": {
        "name": "Sony WH-1000XM6, black",
        "unit_price_minor": 32900,
        "currency": "EUR",
        "condition": "new",
        "availability": "in_stock"
      },
      "capabilities": [
        "https://shop.example/addp/capabilities/checkout"
      ],
      "valid_until": null
    }
  ]
}
